Solution;Hotel;HotelRating;HotelPrice;TotalAttractions;TotalQuality;TotalTime;TotalCost;Day1Attractions;Day1Neighborhoods;Day1Time;Day1Cost;Day2Attractions;Day2Neighborhoods;Day2Time;Day2Cost;Day1Sequence;Day1TransportModes;Day2Sequence;Day2TransportModes
1;The Ritz-Carlton, Montreal;4.9;1013.25;10;54.8;1101.8;1119.22;5;3;487.9;60.50;5;4;613.9;45.47;Notre-Dame Basilica|Notre-Dame-de-Bon-Secours Chapel|Musée du Montréal juif - Museum of Jewish Montreal|L'original Art Gallery|Leonard Cohen Mural;Walking|Car|Walking|Walking|Walking|Walking;City Hall|Cathédrale Christ Church Cathedral|Musée Marguerite-Bourgeoys|Crystal Dreams St Denis - Montreal|Biodôme De Montreal;Walking|Car|Walking|Walking|Walking|Walking
2;The Ritz-Carlton, Montreal;4.9;1013.25;10;54.8;1399.6;1114.25;5;4;715.9;7.22;5;4;683.7;93.79;L'original Art Gallery|Crystal Dreams St Denis - Montreal|La Guilde - Montreal|Saint Joseph's Oratory of Mount Royal|Place d'Armes;Walking|Car|Walking|Walking|Walking|Walking;Notre-Dame Basilica|Musée du Montréal juif - Museum of Jewish Montreal|Musée de l'Holocauste Montréal|City Hall|Oasis Immersion - Montreal;Walking|Car|Walking|Walking|Walking|Walking
3;Ambrose House & Café;3.9;244.25;6;33.7;925.9;321.40;3;1;429.9;36.17;3;2;496.0;40.98;Musée des beaux-arts de Montréal|Leonard Cohen Mural|La Guilde - Montreal;Walking|Car|Walking|Car;McCord Stewart Museum|Cathédrale Christ Church Cathedral|Musee D'Art Contemporain De Montreal;Walking|Car|Walking|Car
4;Samesun Montreal Central;4.4;60.00;8;44.3;1307.9;101.77;4;3;606.2;26.25;4;4;701.7;15.52;Mount Royal Park|Montreal Botanical Garden|Place d'Armes|L'original Art Gallery;Walking|Car|Walking|Walking|Walking;Saint Joseph's Oratory of Mount Royal|Atwater Market|Palais des Congres|Maisonneuve Monument - Montreal;Walking|Car|Walking|Walking|Walking
5;Best Western Plus Hotel Montreal;4.1;249.75;7;38.0;1176.6;345.57;4;4;613.4;40.20;3;3;563.2;55.62;Cathédrale Christ Church Cathedral|Musée du Montréal juif - Museum of Jewish Montreal|Olympic Park (Parc olympique)|L'original Art Gallery;Car|Car|Bus|Bus|Walking;Planétarium De Montréal|Montreal Botanical Garden|Musee D'Art Contemporain De Montreal;Subway|Car|Walking|Car
